{
  "$schema": "https://json-schema.org/draft/2020-12/schema",
  "$id": "https://raw.githubusercontent.com/nccrypto/agentic-commerce-toolkit/main/schemas/community-validation-result-v1.schema.json",
  "title": "Agentic Commerce Community Validation Result v1",
  "description": "A bounded, public-safe record of an external user's network-free toolkit validation run.",
  "type": "object",
  "additionalProperties": false,
  "required": [
    "schemaVersion",
    "validationId",
    "recordedAt",
    "toolkitRevision",
    "environment",
    "status",
    "checks",
    "errors",
    "limitations",
    "sharing"
  ],
  "properties": {
    "schemaVersion": {"const": "1.0"},
    "validationId": {
      "type": "string",
      "pattern": "^[a-z0-9][a-z0-9._:-]{2,127}$",
      "description": "Stable public identifier that does not contain a username, account, wallet, host, or local path."
    },
    "recordedAt": {"type": "string", "format": "date-time"},
    "toolkitRevision": {
      "type": "string",
      "pattern": "^[A-Za-z0-9][A-Za-z0-9._-]{0,63}$",
      "description": "Public tag, branch label, or commit identifier tested."
    },
    "environment": {
      "type": "object",
      "additionalProperties": false,
      "required": ["pythonVersion", "platform"],
      "properties": {
        "pythonVersion": {
          "type": "string",
          "pattern": "^[0-9]+\\.[0-9]+\\.[0-9]+$"
        },
        "platform": {
          "enum": ["linux", "darwin", "win32", "other"]
        }
      }
    },
    "status": {"enum": ["passed", "failed"]},
    "checks": {
      "type": "array",
      "minItems": 1,
      "maxItems": 10,
      "items": {
        "type": "object",
        "additionalProperties": false,
        "required": ["checkId", "status", "summary"],
        "properties": {
          "checkId": {
            "type": "string",
            "pattern": "^[a-z][a-z0-9._-]{1,63}$"
          },
          "status": {"enum": ["pass", "fail"]},
          "summary": {
            "type": "string",
            "minLength": 1,
            "maxLength": 500
          }
        }
      }
    },
    "errors": {
      "type": "array",
      "maxItems": 10,
      "items": {
        "type": "object",
        "additionalProperties": false,
        "required": ["code", "message"],
        "properties": {
          "code": {
            "type": "string",
            "pattern": "^[A-Z][A-Z0-9_]{1,63}$"
          },
          "message": {
            "type": "string",
            "minLength": 1,
            "maxLength": 500
          }
        }
      }
    },
    "limitations": {
      "type": "array",
      "maxItems": 20,
      "items": {
        "type": "string",
        "minLength": 1,
        "maxLength": 500
      }
    },
    "sharing": {
      "type": "object",
      "additionalProperties": false,
      "required": ["reviewedForSensitiveData", "publicSubmissionApproved"],
      "properties": {
        "reviewedForSensitiveData": {"type": "boolean"},
        "publicSubmissionApproved": {"type": "boolean"}
      },
      "description": "Generated results default to false. A human sets these flags only after reviewing the file before public submission."
    }
  },
  "allOf": [
    {
      "if": {
        "properties": {"status": {"const": "passed"}},
        "required": ["status"]
      },
      "then": {
        "properties": {
          "checks": {
            "items": {
              "properties": {"status": {"const": "pass"}}
            }
          },
          "errors": {"maxItems": 0}
        }
      }
    },
    {
      "if": {
        "properties": {"status": {"const": "failed"}},
        "required": ["status"]
      },
      "then": {
        "properties": {"errors": {"minItems": 1}}
      }
    }
  ]
}
